{
  "adapterId": "runtime-state-v1",
  "caller": "machine-consciousness-awareness-v0",
  "traceId": "MC-G8-FIRST-COGNITION-20261001",
  "input": {
    "stateRows": [
      [
        0.47139348681009424,
        1,
        0,
        0.2217536937498511,
        1.6477376742887686,
        1
      ],
      [
        0.5608358790030965,
        1.2976251746195129,
        -0.1387288761718487,
        0.2564007725796393,
        0.9351132356409398,
        1
      ],
      [
        0.6838211375193775,
        2.091902593315398,
        -0.29691057068842475,
        0.2755464618807083,
        1.3131296349968875,
        1
      ],
      [
        0.4131752263483764,
        0.8463784236143659,
        0.5155605158076515,
        0.19555526369274226,
        0.8241452526099571,
        1
      ],
      [
        0.6892733094908616,
        2.5782425610407373,
        -0.6616456635296384,
        0.25155480738042013,
        1.1743534774985567,
        1
      ],
      [
        0.34717979074464966,
        0.6978560637426138,
        0.7455054589599602,
        0.16363487218111958,
        0.7890625222830324,
        1
      ],
      [
        0.6772066071020595,
        2.7736084543220962,
        -0.7986653771895539,
        0.236393780185769,
        1.1204231608894466,
        1
      ],
      [
        0.6167556230035621,
        1.551084453309241,
        0.3915131487980449,
        0.27240661430194846,
        1.4748913729117434,
        1
      ],
      [
        0.4868840277629146,
        1.0453392683055205,
        0.22095486746720727,
        0.2283147017899939,
        0.8722789815837961,
        1
      ],
      [
        0.19160667627256422,
        0.42622583751294263,
        0.3605319963264082,
        0.08429140207461548,
        0.7268671757955191,
        1
      ],
      [
        0.10428245378730822,
        0.31326181825032073,
        0.08251770072992343,
        0.04127808189606104,
        0.7017853145383143,
        1
      ],
      [
        0.0873620074167321,
        0.29455320270554547,
        0.014348361646642438,
        0.033472266034301104,
        0.6976774871174993,
        1
      ],
      [
        0.08450876630016306,
        0.29150609148849077,
        0.002356568261254688,
        0.03218129584477403,
        0.6970096945989159,
        1
      ],
      [
        0.08404250164809415,
        0.29101116003533295,
        0.000383293826149933,
        0.03197108332893891,
        0.6969012607717207,
        1
      ],
      [
        0.5708602480377161,
        3.43724342616466,
        -1.2346075773579053,
        0.16631720083903523,
        0.9453057915302612,
        1
      ],
      [
        0.23136379249647504,
        0.4866384527512598,
        1.093515834460299,
        0.10465046742300951,
        1.0617536317076848,
        1
      ]
    ],
    "ranges": [
      [
        0,
        0.6931471805599453
      ],
      [
        0.13358962336732744,
        3.594753034238593
      ],
      [
        -1.3511387098817755,
        1.209999215547055
      ],
      [
        0.019592860275377304,
        0.29101704384536403
      ],
      [
        0.62021659898203,
        2.3068168203712855
      ],
      [
        0,
        1
      ]
    ]
  }
}
